query_id,query,rag_answer,no_rag_answer,rag_groundedness,no_rag_groundedness,rag_faithfulness,no_rag_faithfulness,groundedness_delta
572a06af3f37b3190047866a,What pathway that plays a role in immune response to viruses is present in all eukaryotes?,The RNA interference pathway is conserved across all eukaryotes and is thought to play a role in the immune response to viruses [1].,"The **RIG-I-like receptor (RLR) signaling pathway** (specifically the RLRs themselves, such as RIG-I and MDA5) is primarily associated with antiviral immunity but is notably absent or highly divergent in many plants. However, if we look for a pathway present in *all* eukaryotes that plays a role in immune response to viruses:

The **Toll-like receptor (TLR)** family was historically thought to be the universal answer, but they are actually restricted to animals and some fungi/plants have distinct homologs. The most accurate answer is likely the **cGAS-STING pathway** or its functional equivalents found across eukaryotes, though it varies significantly in presence between groups (e.g., absent in many plants).

However, based on standard biological consensus regarding pathways present in *all* eukaryotes involved in detecting viral nucleic acids:
There is no single ""universal"" pathway identical in all eukaryotes specifically for **viruses** because the diversity of viruses and hosts makes a 100% universal mechanism unlikely.

But, if referring to the most conserved innate immune signaling component across animals (which are often what this question implies), it is the **TLR/RLR pathway**. If strictly requiring ""all eukaryotes"" including plants/fungi:
The best fit for a broadly conserved nucleic acid sensing mechanism is the **cGAS-STING-like** or **Toll-like receptor (TLR)** homologs found in diverse lineages,",5.0,2.0,5.0,4.0,3.0
5726249538643c19005ad080,What was developed for the Air Force,"Baran developed the concept of distributed adaptive message block switching during his research at the RAND Corporation for the US Air Force into survivable communications networks [1]. This work focused on a decentralized network architecture, dividing messages into packets (later called blocks), and using store-and-forward switching to ensure communication survival.","The **F-16 Fighting Falcon** (also known as the F-47 in some contexts, though this is a common confusion; the correct designation is simply the F-16) was originally developed by General Dynamics for the United States Air Force. It entered service with the USAF in 1978 and has since become one of the most successful fighter aircraft ever produced.",5.0,1.0,5.0,5.0,4.0
57337ddc4776f41900660bbe,Why are the small lakes in the parks emptied before winter?,The majority of small lakes in Warsaw's parks are emptied before winter to clean them of plants and sediments [1].,"Small lakes in many public parks, particularly those with shallow depths or high water tables (like ""sawmill ponds""), are often drained during late summer to prepare for winter primarily **to prevent ice damage and ensure safety**.

When these bodies of water freeze solid, the expanding ice can crack concrete banks, destroy nearby landscaping, and create hazardous conditions for pedestrians. By draining them before temperatures drop significantly below freezing, park managers allow the ground beneath the lake bed to thaw naturally in early spring, which helps maintain stable soil levels when they are refilled later in the season.",5.0,3.0,5.0,5.0,2.0
57332e48d058e614000b5765,How many days did the Warsaw Uprising last?,"The Warsaw Uprising lasted for 63 days [1]. Although it was initially planned to last only 48 hours, the armed struggle continued beyond that duration until the Home Army fighters and civilians were forced to capitulate [1].","The Warsaw Uprising lasted **63 days**.

It began on August 1, 1944, when Polish resistance forces launched an attack against German occupation troops in Warsaw, and ended on October 2, 1944.",5.0,4.0,5.0,5.0,1.0
56e16182e3433e1400422e29,By what main attribute are computational problems classified utilizing computational complexity theory?,"Computational problems are classified according to their inherent difficulty [1]. This classification relates these problem classes to one another and focuses on whether they can be solved with appropriately restricted resources, distinguishing it from computability theory which asks what problems can be solved algorithmically in principle [2]. The distinction often involves imposing restrictions on available resources; for instance, the hardness of calculating discrete logarithms compared to efficient modular exponentiation is a specific example related to this classification framework [3].","Computational problems are primarily classified by their **resource requirements** as a function of the input size, specifically focusing on:

1.  **Time Complexity**: The amount of time (or number of steps) an algorithm needs to solve a problem relative to the input size ($n$). This is often expressed using Big O notation (e.g., $O(n)$ for linear time vs. $O(2^n)$ for exponential time).
2.  **Space Complexity**: The amount of memory required by an algorithm during execution, also measured against the input size.

While these are distinct metrics, they are most commonly used together to determine a problem's difficulty class (such as P, NP, or EXP), which categorizes problems based on whether efficient solutions exist and how hard it is to verify those solutions.",3.0,4.0,4.0,5.0,-1.0
57097051ed30961900e84134,What did BSkyB name their interactive service?,"BSkyB named its interactive service **Open**, which was later rebranded as **Sky Active** [1].","BSkyB named their interactive television service **Sky Interactive**. 

This service was launched in 1987, making it the world's first fully integrated interactive TV system. It allowed viewers to choose channels and access on-demand content via a remote control with buttons for channel selection rather than just tuning dials or sliders.",5.0,1.0,5.0,5.0,4.0
571c3e8cdd7acb1400e4c0a6,What researcher showed that air is a necessity for combustion?,"Robert Boyle proved in the late 17th century that air is necessary for combustion [1]. John Mayow later refined this work by showing that fire requires only a part of air, which he called *nitroaereus* [1].","The French chemist **Antoine Lavoisier** demonstrated in the late 18th century (specifically around 1775) that air is necessary for combustion through his experiments with mercury. He proved that it was not ""phlogiston"" as previously thought, but rather a component of air called oxygen, which supports burning and respiration.",5.0,4.0,5.0,5.0,1.0
5ad0421177cf76001a686f15,How much did southern California grow in the year 2000?,"Based on the provided context, it is not possible to determine how much Southern California grew specifically **in** the year 2000. The document [1] states that between the years of the 2000s (a decade), its growth rate was less than the state average of 10.0%, but it does not provide a specific figure for the single year 2000 or any other individual year within that period.

**Answer:**
The provided context does not contain evidence regarding Southern California's population growth specifically in the year 2000 [1]. It only notes that during the decade of the 2000s, its growth rate was less than the state average of 10.0% [1].","In the year 2000, Southern California's population was approximately **19 million people**. This figure represented a significant growth compared to its pre-World War II size of about 5.3 million residents (in 1947). The region had grown by roughly 16% over the preceding two decades alone and continued this rapid expansion trend, eventually reaching nearly 20 million in subsequent years as it became one of the most populous metropolitan areas globally.",2.0,1.0,4.0,3.0,1.0
